{
  "$schema": "https://json-schema.org/draft/2020-12/schema",
  "$id": "https://changesaga.dev/schema/v5/test-case-event.schema.json",
  "title": "Change Saga v5 test-case lifecycle event",
  "type": "object",
  "additionalProperties": false,
  "required": ["$schema", "version", "id", "test_case", "parents", "state", "created_at"],
  "properties": {
    "$schema": { "const": "https://changesaga.dev/schema/v5/test-case-event.schema.json" },
    "version": { "const": 5 },
    "id": { "$ref": "#/$defs/id" },
    "test_case": { "$ref": "#/$defs/test_case_urn" },
    "parents": {
      "type": "array",
      "maxItems": 10000,
      "uniqueItems": true,
      "items": { "$ref": "#/$defs/event_urn" }
    },
    "state": { "enum": ["proposed", "active", "deprecated", "retired"] },
    "reason": { "type": "string" },
    "created_at": { "type": "string", "format": "date-time" },
    "request_id": { "$ref": "#/$defs/id" }
  },
  "$defs": {
    "id": { "type": "string", "pattern": "^[A-Za-z0-9][A-Za-z0-9._-]{0,127}$" },
    "test_case_urn": { "type": "string", "pattern": "^urn:change-saga:[A-Za-z0-9][A-Za-z0-9._-]{0,127}:test-case:[A-Za-z0-9][A-Za-z0-9._-]{0,127}$" },
    "event_urn": { "type": "string", "pattern": "^urn:change-saga:[A-Za-z0-9][A-Za-z0-9._-]{0,127}:test-case:[A-Za-z0-9][A-Za-z0-9._-]{0,127}:event:[A-Za-z0-9][A-Za-z0-9._-]{0,127}$" }
  }
}
