{
  "$schema": "https://changesaga.dev/schema/v5/test-case-event.schema.json",
  "version": 5,
  "id": "proposed",
  "test_case": "urn:change-saga:change-saga:test-case:core-criterion-reading",
  "parents": [],
  "state": "proposed",
  "created_at": "2026-10-16T23:16:53Z",
  "request_id": "saga-definition-core-criterion-reading"
}
