{
  "$schema": "https://changesaga.dev/schema/v5/test-case-event.schema.json",
  "version": 5,
  "id": "active",
  "test_case": "urn:change-saga:app:test-case:changed-code-impact-and-persona-gaps",
  "parents": [
    "urn:change-saga:app:test-case:changed-code-impact-and-persona-gaps:event:proposed"
  ],
  "state": "active",
  "reason": "Focused executable tests exist and passed at the recorded source commit.",
  "created_at": "2026-09-21T05:56:13Z",
  "request_id": "qpk-activate-changed-code-impact-and-persona-gaps"
}
