{
  "$schema": "https://changesaga.dev/schema/v5/test-case-event.schema.json",
  "version": 5,
  "id": "proposed",
  "test_case": "urn:change-saga:app:test-case:prototype-annotation-currency",
  "parents": [],
  "state": "proposed",
  "created_at": "2026-09-21T05:55:09Z",
  "request_id": "qpk-add-prototype-annotation-currency"
}
