{
  "$schema": "https://changesaga.dev/schema/v5/test-case-event.schema.json",
  "version": 5,
  "id": "proposed",
  "test_case": "urn:change-saga:app:test-case:move-companion-saga-in-repository",
  "parents": [],
  "state": "proposed",
  "created_at": "2026-09-22T00:06:05Z",
  "request_id": "move-companion-saga-in-repository"
}
