{
  "$schema": "https://changesaga.dev/schema/v5/test-case-event.schema.json",
  "version": 5,
  "id": "proposed",
  "test_case": "urn:change-saga:app:test-case:trustworthy-selected-coverage",
  "parents": [],
  "state": "proposed",
  "created_at": "2026-09-21T05:49:58Z",
  "request_id": "quality-add-trustworthy-selected-coverage"
}
