{
  "$schema": "https://changesaga.dev/schema/v5/test-case-event.schema.json",
  "version": 5,
  "id": "proposed",
  "test_case": "urn:change-saga:change-saga:test-case:contracts-serialized-lock-writers",
  "parents": [],
  "state": "proposed",
  "created_at": "2026-10-16T23:23:30Z",
  "request_id": "saga-definition-contracts-serialized-lock-writers"
}
