{
  "$schema": "https://changesaga.dev/schema/v5/test-case-event.schema.json",
  "version": 5,
  "id": "active",
  "test_case": "urn:change-saga:app:test-case:repair-evidence-safely",
  "parents": [
    "urn:change-saga:app:test-case:repair-evidence-safely:event:proposed"
  ],
  "state": "active",
  "reason": "Focused repository tests exist and passed at the recorded source commit.",
  "created_at": "2026-09-21T05:51:40Z"
}
